{
  "version": 1,
  "headSHA": "fb63e78744ce026d810547afbb62c0a08ce2040a",
  "candidates": 10,
  "paths": [
    {
      "id": "order-creation",
      "title": "Create an order (POST create-order → OrderService.create → OrdersRepo.insert)",
      "entry": "code:src/api/orders_handler.py@fb63e78#L6-L11",
      "rank": 1,
      "rationale": "Highest business impact times highest fragility. This is the only flow in which money is recorded, and every fragility signal in the repository converges on it: src/repo/orders_repo.py is the top hotspot (6 of 12 commits, one author, bus factor 1 across all of src/); the INSERT is retried without an idempotency key and already produced duplicate orders in production, fixed by reverting the attempt count from 3 to 2 rather than adding a key; the schema has no unique guard; the only authorization check compares two caller-supplied values (X-User header vs body user_id); the handler validates nothing (KeyError on a missing field, IntegrityError/DataError propagate unmapped); line items are summed and discarded; each request opens a psycopg2 connection that is never closed; and no test imports any of it, so CI stays green through a repeat of the incident. Entry confirmed by reading handle_create_order at L6-L11, which calls require_user (authz.py L8-L10), then OrderService.create (orders.py L9-L11), then OrdersRepo.insert (orders_repo.py L11-L25).",
      "businessImpact": "Every sale enters the database through this path, and a duplicated, lost or misattributed insert is a direct revenue and customer-trust error that nothing in the system logs, guards or tests.",
      "factIds": [
        "F-map-src-002",
        "F-map-src-005",
        "F-map-src-006",
        "F-map-src-007",
        "F-map-src-008",
        "F-map-src-009",
        "F-map-src-011",
        "F-map-src-012",
        "F-map-src-013",
        "F-map-src-014",
        "F-map-src-015",
        "F-map-src-018",
        "F-map-src-021",
        "F-map-src-027",
        "F-map-src-028",
        "F-map-src-029",
        "F-map-src-030",
        "F-map-src-034",
        "F-map-src-035",
        "F-map-src-037",
        "F-map-src-038",
        "F-map-src-039",
        "F-map-db-005",
        "F-map-db-006",
        "F-map-db-015",
        "F-map-db-020",
        "F-map-ci-011",
        "F-map-ci-012",
        "F-lens-data-migrations-003",
        "F-lens-data-migrations-004",
        "F-lens-data-migrations-007",
        "F-lens-data-migrations-008",
        "F-lens-deploy-ops-010",
        "F-lens-deploy-ops-011",
        "F-lens-deploy-ops-012",
        "F-lens-deploy-ops-014",
        "F-lens-deploy-ops-015",
        "F-lens-deploy-ops-017",
        "F-lens-security-tests-001",
        "F-lens-security-tests-004",
        "F-lens-security-tests-005",
        "F-lens-security-tests-006",
        "F-lens-security-tests-007",
        "F-lens-security-tests-011",
        "F-lens-security-tests-013",
        "F-lens-security-tests-014",
        "F-lens-landmines-glossary-001",
        "F-lens-landmines-glossary-002",
        "F-lens-landmines-glossary-003",
        "F-lens-landmines-glossary-010",
        "F-lens-landmines-glossary-013",
        "F-lens-landmines-glossary-014",
        "F-lens-landmines-glossary-015",
        "F-lens-landmines-glossary-016"
      ],
      "traced": true
    },
    {
      "id": "order-read",
      "title": "Read an order by id (GET get-order → OrderService.get → OrdersRepo.fetch)",
      "entry": "code:src/api/orders_handler.py@fb63e78#L14-L16",
      "rank": 2,
      "rationale": "Second because it is the other half of the entire HTTP surface and its fragility is a confirmed security hole rather than a latent one: handle_get_order (L14-L16) has never called require_user and is byte-identical to the initial import, order ids are a SERIAL sequence, and OrdersRepo.fetch (orders_repo.py L27-L31) selects by id alone, so every order's user_id and total is enumerable by any caller with no credentials. Ranked below creation because it does not write money, but each GET also opens a connection that is never closed and left idle in transaction, returns a Decimal total that stdlib json cannot serialize (while create returns a float), and raises TypeError for an unknown id because there is no not-found path. Zero test coverage, no logging, and identical bus-factor-1 ownership.",
      "businessImpact": "Any client can read any customer's order (user id and amount) without authentication, a data-exposure incident that also degrades the database under ordinary read load.",
      "factIds": [
        "F-map-src-003",
        "F-map-src-004",
        "F-map-src-007",
        "F-map-src-016",
        "F-map-src-019",
        "F-map-src-031",
        "F-map-src-035",
        "F-map-src-036",
        "F-map-src-037",
        "F-map-src-038",
        "F-map-db-018",
        "F-map-db-019",
        "F-map-ci-011",
        "F-lens-data-migrations-007",
        "F-lens-data-migrations-024",
        "F-lens-deploy-ops-014",
        "F-lens-security-tests-002",
        "F-lens-security-tests-003",
        "F-lens-security-tests-009",
        "F-lens-security-tests-012",
        "F-lens-landmines-glossary-005",
        "F-lens-landmines-glossary-011",
        "F-lens-landmines-glossary-013"
      ],
      "traced": true
    },
    {
      "id": "production-deploy",
      "title": "Deploy code to an environment (deploy/deploy.sh <env>)",
      "entry": "code:deploy/deploy.sh@fb63e78#L1-L6",
      "rank": 3,
      "rationale": "The deploy is the only route from a commit to production and it is a six-line, single-author script untouched since the initial import: it scp's the operator's local working tree of src/ (not a git ref, so uncommitted edits ship and nothing records the deployed revision), then hard-restarts a single systemd unit over ssh with no health check, drain or second instance. There is no rollback beyond redeploying the previous commit, CI never invokes it (so code can reach production having never passed or even been pushed through CI), the environment argument is an unconstrained hostname prefix with no confirmation, and requirements.txt, config/, templates/ and db/ are never shipped. Ranked below the two request paths because it runs on human demand rather than per customer, but a bad deploy takes down the whole environment with no trace of what was shipped.",
      "businessImpact": "A mistyped environment name or an uncommitted local edit reaches production with downtime on every deploy, no rollback, and no record of which revision is running.",
      "factIds": [
        "F-map-ops-001",
        "F-map-ops-002",
        "F-map-ops-003",
        "F-map-ops-004",
        "F-map-ops-005",
        "F-map-ops-006",
        "F-map-ops-007",
        "F-map-ops-008",
        "F-map-ops-009",
        "F-map-ops-010",
        "F-map-ops-013",
        "F-map-ops-015",
        "F-map-ops-033",
        "F-map-ops-034",
        "F-map-ci-003",
        "F-lens-deploy-ops-001",
        "F-lens-deploy-ops-002",
        "F-lens-deploy-ops-003",
        "F-lens-deploy-ops-004",
        "F-lens-deploy-ops-005",
        "F-lens-deploy-ops-006",
        "F-lens-deploy-ops-007",
        "F-lens-deploy-ops-008",
        "F-lens-deploy-ops-009",
        "F-lens-deploy-ops-018",
        "F-lens-deploy-ops-021",
        "F-lens-deploy-ops-022",
        "F-lens-deploy-ops-023",
        "F-lens-security-tests-016",
        "F-lens-dependencies-009",
        "F-lens-landmines-glossary-004",
        "F-lens-landmines-glossary-009",
        "F-lens-landmines-glossary-012"
      ],
      "traced": true
    },
    {
      "id": "schema-migration",
      "title": "Apply a schema migration by hand (db/migrations/ → psql → schema.sql)",
      "entry": "code:db/migrations/002_split_addresses.sql@fb63e78#L1-L7",
      "rank": 4,
      "rationale": "Schema changes are the second way production data is changed and they travel through a channel unrelated to the code deploy: raw SQL applied by hand with no migration runner, tracking table, transaction wrapper, down script or backup, and a single repository-wide '-- applied' comment that cannot say which environment has received which migration. Migration 002 is written, marked not applied, and drops users.address in the same script that creates addresses without copying any data, so applying it as written destroys every stored postal address irreversibly; the TODO blocking it cites a src/service dependency that never existed at any commit. Ranked fourth because it runs rarely and today's code touches no pending column, but the only person who has written migrations (bus factor 1 in db/) has never committed to src/, and the implicit three-step convention (run SQL, append to schema.sql, flip header) is documented nowhere.",
      "businessImpact": "Applying or mis-ordering a hand-run migration can irreversibly destroy customer address data, with no rollback, backup or per-environment record anywhere in the repository.",
      "factIds": [
        "F-map-db-001",
        "F-map-db-004",
        "F-map-db-009",
        "F-map-db-010",
        "F-map-db-011",
        "F-map-db-012",
        "F-map-db-013",
        "F-map-db-014",
        "F-map-db-018",
        "F-map-db-021",
        "F-map-db-022",
        "F-map-db-024",
        "F-map-db-025",
        "F-map-ops-024",
        "F-lens-data-migrations-002",
        "F-lens-data-migrations-005",
        "F-lens-data-migrations-010",
        "F-lens-data-migrations-012",
        "F-lens-data-migrations-013",
        "F-lens-data-migrations-014",
        "F-lens-data-migrations-015",
        "F-lens-data-migrations-016",
        "F-lens-data-migrations-017",
        "F-lens-data-migrations-018",
        "F-lens-data-migrations-019",
        "F-lens-deploy-ops-006",
        "F-lens-deploy-ops-021",
        "F-lens-landmines-glossary-008",
        "F-lens-landmines-glossary-017"
      ],
      "traced": true
    }
  ],
  "untraced": [
    {